page,claim,claim_label,tags,claim_source_domain,claim_source_url,date_check,source_body,date_fake,dataset,value
https://www.snopes.com/fact-check/trump-order-popular-vote-winner/,president trump signed an executive order naming himself winner of the popular vote.,False,"['donald trump', ' political garbage chute', ' politicalgarbagechute.com', ' satire', ' voter fraud']",https://www.nytimes.com/,https://www.nytimes.com/2017/01/25/us/politics/trump-voting-fraud-false-claim-investigation.html?_r=0,2017/02/02,"After His Claim of Voter Fraud, Trump Vows ‘Major Investigation’ImageA polling site in Ashland, Va., in November. President Trump has insisted, despite a lack of evidence, that many immigrants in the United States voted illegally in Virginia, California and New Hampshire.CreditCreditChet Strange for The New York TimesBy Michael D. Shear and Peter BakerJan. 25, 2017WASHINGTON — President Trump intends to move forward with a major investigation of voter fraud that he says cost him the popular vote, White House officials said Wednesday, despite bipartisan condemnation of his allegations and the conclusion of Mr. Trump’s own lawyers that the election was “not tainted.”In his first days in the Oval Office, Mr. Trump has renewed his complaint that millions of people voted illegally, depriving him of a popular-vote majority. In two Twitter posts early Wednesday morning, the president vowed to open an inquiry to reveal people who are registered to vote in multiple states or who remain on voting rolls long after they have died.“We have to understand where the problem exists, how deep it goes, and then suggest some remedies to it,” said Sean Spicer, the president’s press secretary. He said the White House would reveal more details this week.But voting officials in both parties across the country said the answer to those questions is already clear: Fraudulent voting happens in tiny, sporadic episodes that have no impact on the outcome of elections. It is virtually impossible, several state election officials said, that millions of people voted illegally in last year’s presidential contest.In fact, that was the conclusion of Mr. Trump’s own lawyers last year as they sought to stop recount efforts in Michigan, Pennsylvania and Wisconsin.“All available evidence suggests that the 2016 general election was not tainted by fraud or mistake,” Mr. Trump’s lawyers wrote in their response to recount petitions by Jill Stein, the Green Party presidential candidate. Mr. Spicer said the lawyers were referring only to states where Mr. Trump campaigned extensively.In Ohio, Secretary of State Jon A. Husted, a Republican, said Wednesday in an interview that there was “no evidence” that voter fraud was happening on a large scale. Edgardo Cortés, Virginia’s election chief, a Democrat, said there was “no basis” for the claims. And California’s Democratic secretary of state lashed out at the president for undermining confidence in the election system.“Free and fair elections are the bedrock of our democracy, and he’s taken a jackhammer to it with his irresponsible tweets,” said Alex Padilla, the state’s top election official. “Whatever proof or evidence he said he had, he clearly didn’t have. His allegations since November are clearly lies, not alternative facts.”Mr. Trump has repeatedly shifted his view of the election system. As a candidate, he frequently railed against what he called a “rigged” election . When he became president-elect, he complained about “serious voter fraud,” but later reversed himself and mocked Ms. Stein’s recount efforts as “a scam” and a waste of time and money.This week, he flip-flopped again, telling lawmakers at a White House reception that Hillary Clinton won the popular vote because millions of immigrants in the country illegally voted for her. Mr. Spicer declined to elaborate on what Mr. Trump meant but did not back away from the assertion.“The president does believe that,” Mr. Spicer said. “It’s a belief that he’s maintained for a while, a concern that he has about voter fraud. And that’s based on information that’s provided.”It remains unclear what form a federal investigation may take. While the F.B.I. has the authority to look into voter fraud, that appears not to be what the president has in mind. Mr. Spicer said it was too early to know, but mentioned the possibility of a task force or commission.He cited studies that he said showed that voter rolls contained the names of millions of people who should not be there because they had moved, were not citizens or had since died. But the author of one of those major studies said Wednesday that Mr. Spicer and the president appeared to be misunderstanding the numbers.David Becker, who for six years was in charge of the election initiative for the Pew Center on the States, said that voter rolls often had out-of-date information, but that there was virtually no evidence that many of those names were used to vote illegally.“It does exist, but it happens in very, very small numbers and nothing like what is claimed by the president,” Mr. Becker said. He said systems across the country to prevent voter fraud would have caught any huge effort to vote illegally. “We would have seen that well before the election,” he said. “We would have seen a swelling of the voter rolls and records.”In Ohio, for example, a review of the state’s elections in 2012 and 2014 found that out of millions of votes cast, there were 667 allegations of fraud, of which just 149 were referred to law enforcement for investigation, Mr. Husted said. The Ohio review, which happens after every election, also found that 436 unauthorized immigrants were registered to vote and that 44 had voted.ImageThe legal team representing then President-elect Donald J. Trump, including Donald F. McGahn II, the current White House counsel, argued in a brief that no voter fraud had occurred in the general election.“Voter fraud exists. It’s not widespread or systemic,” said Mr. Husted, who said he had voted for Mr. Trump. “There’s no evidence that that is happening on a wide-scale basis.”Mr. Husted said he would be happy to share Ohio’s review of the 2016 election with the federal government when it was completed. And he said Mr. Trump could aid states by sharing government databases that could help them clean their voter rolls.In his Twitter message Wednesday, Mr. Trump suggested that a federal review could lead to improvements in voting procedures.But Democrats and voting experts criticized the president for focusing his allegations on voter fraud while resisting the intelligence community’s conclusions involving Russian hacking of the Democratic National Commitee and officials connected to Mrs. Clinton during last year’s election.“It’s more important that we investigate the known instances of election fraud, rather than imagined ones,” said Kim Alexander, the president of the California Voter Foundation, a nonprofit, nonpartisan organization dedicated to improving the voting process. “We have had an election that was compromised by foreign interests. That’s the real danger that has come out of this election.”Senator Lindsey Graham, Republican of South Carolina, said the president should “knock this off” and move on. “This is going to erode his ability to govern this country if he does not stop it,” he said on CNN .And several Democratic lawmakers and state election officials said they suspected that Mr. Trump’s allegations were part of a plan by Republicans looking for reasons to justify new restrictions on voting to benefit their party, particularly targeting immigrants and African-Americans.“There has been a sustained effort across the country, rooted in similar conspiracies about voter fraud, to make it harder for Americans to vote,” Senator Dianne Feinstein of California said in a statement. “We can’t allow this attack on voting rights to continue, and it’s shameful to see such debunked conspiracy theories emanating from the White House.”Mr. Padilla, the California secretary of state, said he also worried that Mr. Trump’s repeated allegations about fraud would undermine the confidence that Americans had in the integrity of the voting system. “Stoking fear and concern is undermining people’s faith in our elections,” he said.Emmarie Huetteman contributed reporting.Follow The New York Times’s politics and Washington coverage on Facebook and Twitter , and sign up for the First Draft politics newsletter .A version of this article appears in print on , on Page A1 of the New York edition with the headline: Pledge to Find Election Fraud Few Say Exists. Order Reprints | Today’s Paper | SubscribeRelated Coverage",2017/01/25,snopes,0
https://www.snopes.com/fact-check/lions-save-christians-from-islamic-militants/,a group of lions intervened and saved christian missionaries from being stoned to death by islamic militants in asia.,Unproven,"['bangladesh', ' christians', ' fed to lions', ' hellochristian', ' lions', ' rome', ' wnd']",http://www.pbs.org/,http://www.pbs.org/wnet/nature/indias-wandering-lions-asiatic-lion-fact-sheet/14129/,2017/04/26,"Explore more from this episode MoreAdult male Asiatic lion. © Omar Adam KhanWe typically associate lions with Africa and with good reason. Of the roughly 20,000 lions left in the wild, almost all are found in Africa. With one notable exception: the Asiatic lions of the Gir forest.The Asiatic lion (panthera leo persica) is similar in most respects to its African cousins. The most prominent differences are a fold of skin that runs along its belly and a reduced mane in males. About half of the remaining population have a split infraorbital foramen, the hole under the eye socket where facial nerves pass through. It’s thought these differences may be due to inbreeding.Location of Gir National Park. Credit: Wikipedia/MiljoshiUp until the 17th century, Asiatic lions were found as far west as Palestine and throughout Arabia, Persia and Northern India. The spread of firearms and indiscriminate hunting led to their extinction in most of these areas. By the end of the 1800s only a small population remained in Junagadh province on India’s west coast.Once the hunting grounds for the royalty of Junagadh province, the Gir forest became Asiatic lion’s last refuge. In the early 1900s, Nawab Muhammad Rasul Khanji Babi, the ruler at the time, noticed the lions had all but disappeared; he counted only 12 in the entire forest. Fearing their extinction, he declared the Gir a protected area.In 1936, the first official lion census was conducted and found 150 lions. Since then, a census has been taken every five years and has generally shown an upward trend. The most recent census, taken in 2015, counted 523 lions living in the Gir. This was welcome news as the population had grown by about 27 percent from 2010 and suggests conservation measures are having an effect.In 1965, the Indian government declared the Gir forest a wildlife sanctuary. The sanctuary was expanded to cover peripheral forests, and the core area named Gir National Park. Today, the Gir covers a 545 square-mile area of deciduous forest, thorn forest and savannah. It plays host to a number of other large carnivores including leopards, spotted hyenas, honey badgers and golden jackals.Beginning in 1972, human activity was prohibited inside the park. The Maldhari, tribal herdsmen who once supplied milk and cheese to Indian royalty, were relocated and prohibited from grazing their cattle in the forest. The lions and herdsmen had coexisted rather peacefully for centuries even though the lions often poached Maldhari cattle. A study conducted in the mid-1970s found that up to 75 percent of the lion’s diet consisted of livestock.However, concerns about overgrazing, deforestation and the spread of disease to wild ungulates convinced the government to move the Maldhari and their cattle. To discourage harm to lions, as well as forest grazing, the Indian government compensates the herdsmen for cattle killed near the park, but not inside of it.Three cubs Asiatic lion cubs. © Omar Adam KhanWith the Maldhari moved to the periphery, the population of wild ungulates in the Gir has soared. The total number of prey species, such as spotted deer, wild boar, sambar (large deer), blue bull, chinkara (gazelle), and chousingha (four-horned antelope) have increased by 600 percent. As a result, the lions’ diet has shifted. A recent survey of scats (feces) found that only 25 percent of the their diet now consists of domestic cattle.By any measure, the lions of the Gir are a conservation success story. In fact, they may have become too successful, overgrowing the bounds of their sanctuary. As much as 40 percent of the population now lives outside the park bounds in satellite groups. Here, the big cats are at greater risk of death or injury due conflict with people or run-ins with cars or trains. A recent initiative, the Asiatic Lion Reintroduction Project, would take the surplus of lions and move them to a sanctuary in an adjacent Indian state. The move has been contested by local residents who are fiercely proud of their lions. IUCN/SSC Cat Specialist Group http://www.catsg.org/m/index.php?id=113Wildlife Conservation Trust of India http://www.asiaticlion.org/Divyabhanusinh. The Story of Asia’s Lions. Marg Publications, 2005.Crocke, V. The Secret Lions Of India. WBUR. http://thewildlife.wbur.org/2015/04/22/the-secret-lions-of-india/Singh, H.S. and Gibson, L. A conservation success story in the otherwise dire megafauna extinction crisis: The Asiatic lion (Panthera leo persica) of Gir forest. Biological Conservation, 2011.Jayalakshmi K. India: Asiatic lions cramped in Gir as numbers go up and translocation held up. International Business Times, 2015. http://www.ibtimes.co.uk/india-asiatic-lions-cramped-gir-numbers-go-translocation-held-1504794Sudipta, M. Gir Forest and the saga of the Asiatic lion. Indus Pub. Co., 2005.More from India’s Wandering Lions (5)",2016/04/14,snopes,0
https://www.snopes.com/fact-check/judi-dench-harvey-weinstein-tattoo/,actress judi dench has havey weinstein's initials tattooed on her butt.,False,"['harvey weinstein', ' judi dench', ' judi dench tattoo']",https://www.vanityfair.com/,https://www.vanityfair.com/style/2016/06/judi-dench-tattoo,2017/10/09,"At 81, Dame Judi Dench Gets Her First TattooThe Oscar winner got some proper ink.byTwitterBy Anthony Harvey/Getty Images.Once, as a practical joke, Judi Dench had a fake tattoo of Harvey Weinstein’s name applied to her derrière . The spunky English actress credited the studio head for reviving her career in the U.S. via Weinstein titles like Chocolat, Iris, Mrs. Henderson Presents, and Notes on a Scandal—all of which earned her Oscar nominations—and Shakespeare in Love, for which Dench won the supporting-actress Oscar, in 1999. Committed to the performance—when is she not?—Dench unveiled the faux ink at the Four Seasons over lunch with Weinstein and Charlie Rose . Recalled the actress, “I’ve never seen a man more embarrassed.” But now, at the age of 81, Dench has gone ahead and gotten a tattoo for real.She did not get Weinstein’s name immortally etched into her arm, though. Instead, she got the words “carpe diem” inscribed on her wrist as a gift from her daughter, Finty Williams. In an interview with Surrey Life , Dench explained the ink: “That’s my motto: seize the day. Finty gave it to me for my 81st birthday—she’s wonderful with surprises.”Dench had previously told Good Housekeeping that she was toying with the idea of getting an actual tattoo, but had one hesitation.“There’s an Indian symbol that I like which supposedly represents life and love and everything,” Dench said, explaining what she would have inked onto her arm. “One of the cameramen who worked on The Second Best Exotic Marigold Hotel told me what it meant, but I’m a bit nervous in case I’m being set up. It might be unbelievably rude.”Dench has been working her way up to the tattoo, between the Weinstein prank and a bejeweled design that she wore to the 2012 premiere of Skyfall. Having played the beloved character “M” since 1995, Dench pledged her allegiance to James Bond by arriving on the red carpet with jewels spelling out “007” on her neck.Get Vanity Fair’s Cocktail HourOur essential brief on culture, the news, and more. And it's on the house.E-mail AddressSubscribeUse of this site constitutes acceptance of our User Agreement and Privacy Policy and Cookie Statement .Share",2016/06/30,snopes,0
https://www.snopes.com/fact-check/spirit-airlines-military/,"a spirit airlines employee was rude to a soldier, charged him for a carry-on bag, and told his father that the airline ""doesn't cater to the military."" see example( s )",Unproven,"['john hucul', ' shunned serviceman', ' spirit airlines', ' veteran discounts']",https://customersupport.spirit.com/,https://customersupport.spirit.com/hc/en-us/articles/202096896-Does-Spirit-offer-discounts-for-bereavement-military-children-students-or-senior-citizens-,2015/11/02,"Spirit Airlines, Inc. Derechos Reservados.CONTACT SUPPORT COMUNĺQUESE CON NOSOTROSHey there! The more we know about what you need help with, the better (and faster) we will be able to assist you. ¡Hola! Mientras más conocemos acerca de lo que necesita, le podremos asistir mejor (y más rápidamente)............ POSSIBLE SOLUTIONS ..........View all related solutions Ver todas las soluciones relacionadasNone of the above solutions was quite right? Send a message directly to our support team. Ninguna de las soluciones anteriores fue del todo bien? Enviar un mensaje directamente a nuestro equipo de soporte.No existing solutions were found to match your query. Send a message directly to our support team. No se encontraron las soluciones existentes para que coincida con la consulta. Enviar un mensaje directamente a nuestro equipo de soporte.",2015/06/01,snopes,0
https://www.snopes.com/fact-check/did-u-s-government-ban-lawn-dart-sales/,the u.s. government banned the sale of lawn darts in the aftermath of a child's death.,True,"['gun control', ' guns', ' lawn darts', ' mass shootings']",https://www.upi.com/,https://www.upi.com/Archives/1988/10/28/Deaths-injuries-prompt-lawn-dart-ban/9940594014400/,2017/10/09,"Deaths, injuries prompt lawn dart banByJANET BASS(0)WASHINGTON -- A federal agency's ban on lawn darts was a bittersweet victory for David Snow, who began a one-man crusade to forbid the product after his 7-year-old daughter died when a lawn dart was thrown into her head.The Consumer Product Safety Commission banned the sale of lawn darts Friday, effective in mid-December, saying the product is not a toy but a dangerous projectile that has caused thousands of injuries and at least three deaths, including that of Snow's daughter, Michelle.'My year-and-a-half struggle is now over,' said Snow, a 40-year-old aerospace production superviser in Riverside, Calif. 'I made seven trips to Washington. I got blisters on my feet. But I just kept at it and today is the payoff. At least now I can say I kept my promise to my little girl.'Michelle Snow died in April 1987 after a dart thrown by another child became embedded in her brain.The ban, approved on a 2-0 vote with one abstention, is the final step on the CPSC's journey to get lawn darts out of the hands of children. Previous regulatory action had required stores to include warnings that the product is for adult-use only. The agency also required stores selling lawn darts to only sell them in sporting goods departments, not toy departments.'In the last 10 years, about 7,000 individuals have required hospital emergency care and a disproportionate number of them have been children,' said CPSC general counsel James Lacy.'For 18 years, the government has sought solutions to prevent children from being severely injured and killed by lawn darts,' said CPSC Commissioner Anne Graham. 'Clearly, the soundest solution is the one we made today.'But officials of the sporting goods industry felt the solution was too drastic.'We felt that a ban is not warranted based on the limited number of fatalities associated with the product,' said Jan Kinney, the Washington director of the Sporting Goods Manufacturers Association Inc. 'If used properly, the product poses no safety hazard and that stronger enforcement by the CPSC could have corrected any distribution problem and not denied millions of Americans ... years of recreational enjoyment.'An owner of the only domestic supplier of lawn darts agreed and questioned the agency's fairness.'I think things are wrong with guns. Which is the greater evil - lawn darts that kill three people or guns that kill ... thousands in a year?' asked Bob Archer, one of the owners of Kent Sporting Goods in New London, Ohio.There are about 14 importers of lawn darts and Lacy said CPSC Chairman Terrence Scanlon will inform Customs Service officials of Friday's action to prevent the importation of lawn darts.Lacy described lawn darts as '18 inch-long projectiles with pointed metal or plastic tips that are intended to stick in the ground.' He said they weigh about 1 pounds.Congress passed legislation last week ordering the commission to ban lawn darts. Sen. Albert Gore Jr., D-Tenn., sponsored the legislation, calling the toys 'lethal weapons.' More than 500,000 sets are sold each year.Snow said he has talked with the parents of 11-year-old Amy Herrin of Nashville, Tenn., who has been kept in a deep coma since her cousin accidentally threw a dart into her forehead. Doctors induced the coma to prevent brain swelling after eight hours of surgery to remove the dart.'I knew it would be just a matter of time before I picked up a newspaper and saw it happened again,' Snow said. 'I wanted to prevent this. It's too late for my little girl, but maybe this will be the last one,' he said.Coincidentally, on Oct. 25, Federal Judge Joyce Green ruled in Sears, Roebuck and Co.'s favor on charges brought by CPSC that a Sears store in Puerto Rico violated a March 1988 consent decree involving the sale of lawn darts.Green said Sears had taken all possible steps to comply with the decree and should not be held in contempt of court because of a problem with one store.But Sears and all stores will have to clear their shelves of lawn darts when the ban becomes effective in mid-December, making it difficult for parents to buy lawn darts as last-minute Christmas gifts.Follow us on Facebook , Twitter and Instagram for more UPI news and photos.(0) Leave a comment",2017/10/10,snopes,0
