page,claim,claim_label,tags,claim_source_domain,claim_source_url,date_check,source_body,date_fake,dataset,value
https://www.snopes.com/fact-check/italian-doctor-multiple-sclerosis/,an italian doctor uncovered a surprisingly simple cure for multiple sclerosis in april 2016. see example( s ),false,"['disease', ' italian doctor', ' medical clickbaiting', ' ms', ' multiple sclerosis', ' not actually a study', ' usa daily records']",http://www.telegraph.co.uk/,http://www.telegraph.co.uk/news/2016/03/22/miraculous-results-from-new-ms-treatment/,2016/04/27,"'Miraculous' results from new MS treatmentSaveSaveHolly Drewry, 25, of Sheffield, was wheelchair bound after the birth of her daughter Isla, now two Credit: BBCOtherA pioneering new stem cell treatment is reversing and then halting the potentially crippling effects of multiple sclerosis .Patients embarking on a ground-breaking trial of the new treatment have found they can walk again and that the disease even appears to be stopped in its tracks.“I started seeing changes within days of the stem cells being put in. It was a miracle”Patient Holly DrewryHolly Drewry, 25, from Sheffield, was wheelchair bound after the birth of her daughter Isla, now two.But Miss Drewry claims the new treatment has transformed her life.She told the BBC’s Panorama programme: “I couldn’t walk steadily. I couldn’t trust myself holding her (Isla) in case I fell. Being a new mum I wanted to do it all properly but my MS was stopping me from doing it.“It is scary because you think, when is it going to end?” The treatment is being carried out at Royal Hallamshire Hospital in Sheffield and Kings College Hospital, London and involves use a high dose of chemotherapy to knock out the immune system before rebuilding it with stem cells taken from the patient’s own blood.Miss Drewry had the treatment in Sheffield. She said: “I started seeing changes within days of the stem cells being put in.“I walked out of the hospital. I walked into my house and hugged Isla. I cried and cried. It was a bit overwhelming. It was a miracle.”Her treatment has now been reviewed and her condition found to have been dramatically halted. She will need to be monitored for years but the hope is that her transplant will be a permanent fix.She is now planning to get married.For other patients, the results have been equally dramatic. Steven Storey was a marathon runner and triathlete before he was struck down with the disease and left completely paralysed: “I couldn’t flicker a muscle,” he said.But within nine days of the treatment he could move his toe and after 10 months managed a mile-long swim in the Lake District. He has also managed to ride a bike and walk again.“It was great. I felt I was back,” he said.Alastair Hignell: How I'm tackling MSMr Storey celebrated his first transplant birthday with his daughters. His treatment has been reviewed and, like Miss Drewry, there was no evidence of active disease.The treatment – which effectively ‘reboots’ the immune systems - is the first to reverse the symptoms of MS, which has no cure, and affects around 100,000 people in Britain.Stem cells are so effective because they can become any cell in the body based on their environment.""Since we started treating patients three years ago, some of the results we have seen have been miraculous""Professor Basil SharrackAlthough it is unclear what causes MS, some doctors believe that it is the immune system itself which attacks the brain and spinal cord, leading to inflammation and pain, disability and in severe cases, death.Professor Basil Sharrack, a consultant neurologist at Sheffield Teaching Hospitals NHS Foundation Trust, said: ""Since we started treating patients three years ago, some of the results we have seen have been miraculous.""This is not a word I would use lightly, but we have seen profound neurological improvements.""During the treatment, the patient's stem cells are harvested and stored. Then doctors use aggressive drugs which are usually given to cancer patients to completely destroy the immune system.The harvested stem cells are then infused back into the body where they start to grow new red and white blood cells within just two weeks.Within a month the immune system is back up and running fully and that is when patients begin to notice that they are recovering.However specialists warn that patients need to be fit to benefit from the new treatment.The research has been published in the Journal of the American Medical Association.Panorama - Can you stop my multiple sclerosis? is on BBC1 at 8.30pm on Monday, January 18.Follow Telegraph News",2016/01/17,snopes,0
https://www.snopes.com/fact-check/epa-seeks-ban-racecar-conversions/,the u.s. environmental protection agency is banning the conversion of road cars to racecars. see example( s ),Mostly False,[''],https://www.sema.org/,https://www.sema.org/about-sema?__utma=95790915.1769030802.1455140394.1455140394.1455140394.1&__utmb=95790915.0.10.1455140394&__utmc=95790915&__utmx=-&__utmz=95790915.1455140394.1.1.utmcsr=google%7Cutmccn=(organic)%7Cutmcmd=organic%7Cutmctr=(not%20provided)&__utmv=-&__utmk=240858955,2016/02/10,"in About SEMAA love for cars, trucks and SUVs is the motivating force behind the Specialty Equipment Market Association (SEMA). This trade association consists of a diverse group of manufacturers, distributors, retailers, publishing companies, auto restorers, street-rod builders, restylers, car clubs, race teams and more.SEMA members make, buy, sell and use all kinds of specialty parts and accessories to make vehicles more attractive, more unique, more convenient, faster, safer, more fun and even like-new again.The companies that founded SEMA—and the entire specialty parts and accessories industry, for that matter—were started by people who loved cars and trucks and turned their hobby into a career. Most people in the industry today still feel this way. That’s one of the things that makes SEMA and its members unique.Today the organization performs many services for its members and for the hobby as a whole. Perhaps most importantly, SEMA works hard to protect consumers’ rights to drive accessorized, customized and vintage vehicles. SEMA keeps close tabs on legislators in Washington, D.C., and also in each state within the United States, so SEMA members and anyone who loves cars and trucks can protest pending legislation that might harm our hobby, as well as endorse legislation that’s good for car lovers. SEMA also has helped numerous consumers interact with car dealers, who sometimes try to get away with charging for repairs on a modified vehicle by claiming (wrongly) that specialty accessories have voided its warranty.Every year, SEMA also presents an enormous trade show in Las Vegas. This is where manufacturers unveil their latest offerings, while buyers, distributors and members of the press walk their feet off to see it all. Visit SEMAShow.com for more information .The variety is astonishing, from restyling accessories and automotive organizers to engine parts, restoration supplies, street-rod components and safety enhancements.Rate this article:",2017/01/31,snopes,0
https://www.snopes.com/fact-check/spacesuit-envy/,"nasa had to relabel the size chart used for a condom-like urination contraption built into the maximum absorbency garment space suit system because astronauts refused to choose the ""small"" size.",Mixture,['nasa'],http://www.amazon.com/,http://www.amazon.com/Carrying-Fire-An-Astronauts-Journeys/dp/0374531943,2017/09/16,"January 11, 2013Format: PaperbackVerified PurchaseMichael Collins has a genuine gift with prose; he describes precisely and with flair, has a deadpan wit that can be as dry as the desert and as innocent as a lamb, and is simply the finest writer of the Mercury-Gemini-Apollo astronauts. His book gives a first-hand account not only of the selection process that he endured, but the hectic, colorful, Astro-A-Go-Go world of Houston in the Sixties.He somehow resists the urge to turn his story into self-adulation, bully pulpit, or tedium; an urge that seemingly overpowered many of his fellow astronauts when they 'wrote' their own books. His 'reporter's eye' and droll wit is especially surprising in someone that is a military academy graduate, career officer (he retired with great distinction as a lieutenant general), and a trained engineer.Collin's description of the training and flight of Gemini 10 with 'Corned Beef' John Young is vivid and arresting. His narration of his space walk is so entrancing that it settled the question -- at least, for me -- what it was truly like 'up there'.Apollo 11, the Big Enchilada, is one of the book's finest segments. Collins gives readers such a sense of belonging to the mission themselves that it is irresistible. He describes the training in the simulators, the torture in the 'Vomit Comet' and the 'G-Wheel', and how it was to work with Armstrong and Aldrin. In this last, he is frank and candid. As he notes, it is difficult to have so many 'overachieving sons of overachievers' working together without some friction. He relates a small flare between the other two, after a 'crash' on the lunar surface during simulator training. This incident later appeared, nearly verbatim in the magnificent Tom Hanks 'From Earth to Moon' series.Collins also takes particular care to pay homage and respect to the most unappreciated and neglected of the astronaut's support system -- his wife, Patricia. By the way, he and Patricia are still married (to each other), for about a half century, having been married at Chambley, France, which happens to be where I was born. Although I doubt that the two events are related. At least, one hopes so.This book also has the advantage of giving color and life to other books about the space program, particularly Andrew Chaikin's wonderful 'A Man on the Moon: The Voyages of the Apollo Astronauts', and Gene Kranz's 'Failure Is Not An Option'.Collins has that most difficult-to-exercise gift of the writer -- what to leave on the cutting room floor. I always found myself feeling, as I do with a great actor, of wanting just a little more. He never over-explains, and his description, even of the most prosaic and mundane things, is terse, apt, and still vibrant and vivid. I believe that he could write a pilot's checklist and make it absorbing. This is one of the books that I buy in bulk, and give away. Not only is it a record of a fascinating time in history, but it is a fine example of how such a tale should be written.A small aside about the humor in the book; there is a footnote regarding radio procedures among fighter pilots that is simply one of the funniest things that I've ever read. How many footnotes have ever made you laugh aloud? I read the book (in one sitting, I might add, and yes -- it's that good) while occupying a booth next to a plate-glass window in a tavern during an afternoon of mixed thundershowers and blasting sunlight. When I read that particular bon mot, I roared, causing the other customers to stare and the waitress to bring me a glass of water and ask if I were all right.I also owe a personal debt to Michael Collins. My brilliant and beautiful wife, Diane, are getting ready to retire. When our financial adviser asked me to describe my goals for a perfect retirement, I thought for a moment, and paraphrased something that Collins had said in his magnificent book: ""Sitting on the porch in the evening, and talking to my wife.""",2012/04/29,snopes,0
https://www.snopes.com/fact-check/trump-reverses-insecticide-ban-dow-chemicals/,"chlorpyrifos, an insecticide with alleged origins in nazi germany, was set to be banned by the epa over health and environmental safety concerns; but president trump reversed this decision after dow chemicals, a manufacturer of the chemical, donated one million dollars to his inauguration fund.",Mostly True,"['chlorpyrifos', ' dow chemical', ' epa', ' pesticide', ' scott pruitt', ' trump administration']",https://www.nytimes.com/,https://www.nytimes.com/2017/03/29/us/politics/epa-insecticide-chlorpyrifos.html,2017/11/27,"E.P.A. Chief, Rejecting Agency’s Science, Chooses Not to Ban InsecticideImageScott Pruitt, the head of the Environmental Protection Agency, on Tuesday. Mr. Pruitt rejected a petition filed a decade ago by two environmental groups asking that the agency ban all uses of chlorpyrifos.CreditCreditJim Watson/Agence France-Presse — Getty ImagesBy Eric LiptonMarch 29, 2017WASHINGTON — Scott Pruitt, the head of the Environmental Protection Agency, moved late on Wednesday to reject the scientific conclusion of the agency’s own chemical safety experts who under the Obama administration recommended that one of the nation’s most widely used insecticides be permanently banned at farms nationwide because of the harm it potentially causes children and farm workers.The ruling by Mr. Pruitt , in one of his first formal actions as the nation’s top environmental official, rejected a petition filed a decade ago by two environmental groups that had asked that the agency ban all uses of chlorpyrifos. The chemical was banned in 2000 for use in most household settings , but still today is used at about 40,000 farms on about 50 different types of crops, ranging from almonds to apples.Late last year, and based in part on research conducted at Columbia University, E.P.A. scientists concluded that exposure to the chemical that has been in use since 1965 was potentially causing significant health consequences. They included learning and memory declines, particularly among farm workers and young children who may be exposed through drinking water and other sources.But Dow Chemical, which sells the product under the trade name Lorsban , along with farm groups that use it, had argued that the science demonstrating that chlorpyrifos caused such harm is inconclusive — especially when properly used to kill crop-spoiling insects.An E.P.A. scientific review panel made up of academic experts last July also had raised questions about some of the conclusions the chemical safety staff had reached. That led the staff to revise the way it had justified its findings of harm, although the agency employees as of late last year still concluded that the chemical should be banned.Mr. Pruitt, in an announcement issued Wednesday night , said the agency needed to study the science more.“We need to provide regulatory certainty to the thousands of American farms that rely on chlorpyrifos, while still protecting human health and the environment,” Mr. Pruitt said in his statement. “By reversing the previous administration’s steps to ban one of the most widely used pesticides in the world, we are returning to using sound science in decision-making — rather than predetermined results.”The United States Department of Agriculture, which works close with the nation’s farmers, supported Mr. Pruitt’s action.“It means that this important pest management tool will remain available to growers, helping to ensure an abundant and affordable food supply for this nation,” Sheryl Kunickis, director of the U.S.D.A. Office of Pest Management Policy, said in a statement Wednesday.Dow Agrosciences, the division that sells the product, also praised the ruling, calling it in a statement “the right decision for farmers who, in about 100 countries, rely on the effectiveness of chlorpyrifos to protect more than 50 crops.”But Jim Jones, who ran the chemical safety unit at the E.P.A. for five years, and spent more than 20 years working there until he left the agency in January when President Trump took office, said he was disappointed by Mr. Pruitt’s action.“They are ignoring the science that is pretty solid,” Mr. Jones said, adding that he believed the ruling would put farm workers and exposed children at unnecessary risk.The ruling is, in some ways, more consequential than the higher profile move by Mr. Trump on Tuesday to order the start of rolling back Obama administration rules related to coal-burning power plants and climate change.In rejecting the pesticide ban, Mr. Pruitt took what is known as a “final agency action” on the question of the safety and use of chlorpyrifos, suggesting that the matter would not likely be revisited until 2022, the next time the E.P.A. is formally required to re-evaluate the safety of the pesticide.Mr. Pruitt’s move was immediately condemned by environmental groups, which said it showed that the Trump administration cared more about catering to the demands of major corporate players, like Dow Chemical, than the health and safety of families nationwide.“We have a law that requires the E.P.A. to ban pesticides that it cannot determine are safe, and the E.P.A. has repeatedly said this pesticide is not safe,” said Patti Goldman, managing attorney at Earthjustice, a San Francisco-based environmental group that serves as the legal team for the Natural Resources Defense Council and the Pesticide Action Network of North America, which filed the petition in 2007 to ban the product.The agency had been under court order to issue a ruling on the petition by Friday. The environmental groups intend to return to the Ninth Circuit Court of Appeals in San Francisco to ask judges to order the agency to “take action to protect children from this pesticide” Ms. Goldman said on Wednesday.Correction: An earlier version of this article misstated part of the name of an environmental advocacy group. It is the Natural Resources Defense Council, not the National Resources Defense Council.A version of this article appears in print on , on Page A21 of the New York edition with the headline: E.P.A. Chief Won’t Ban Insecticide Thought to Be Risky. Order Reprints | Today’s Paper | SubscribeRelated Coverage",2017/03/29,snopes,0
https://www.snopes.com/fact-check/karin-mcquillan-pen-op-ed-arguing-trump-right-africa/,former peace corps volunteer karin mcquillan wrote an opinion piece arguing that president trump was right about africa.,Correct Attribution,"['karen mcquillan', ' peace corps', ' shithole']",https://www.theodysseyonline.com/,https://www.theodysseyonline.com/dear-donnie,2018/01/24,"commentsDear Mr. President,You need to get out and travel more. If you did, you wouldn’t say that I live in a shithole country. You know how difficult you’ve made my job as a Peace Corps Volunteer. People constantly associate me with your actions and your hurtful words about the country and continent that they grew up in. I live in Uganda, so I can tell you first hand that this is one of the most beautiful countries that I have ever been to. IT IS NOT A SHITHOLE COUNTRY. I have also been to Rwanda, and I can tell you that it is incredible--filled with the most stunning views and amazing landscapes. NOT A SHITHOLE COUNTRY. The people who live in these two countries are kind, hardworking, dedicated, loving, and oh so welcoming. We would be lucky to have these people in America. I have been treated kinder and more like family in these two countries than I ever have been in America. I don’t understand how you can call these countries shithole countries when you have probably never been there and when America isn’t so perfect. Mr. President, I don’t think you have any right to call these countries shithole countries when you have probably never been there, and even if you have been there you still have no right to call them shithole countries.Mr. President, you know that America was founded on immigration, that the founded fathers came here to escape. Then there was Ellis Island where people could enter our country for a better life and in order to live the American dream. It really bothers me that you are so against immigration when all these people are trying to do is create a better life for themselves and their families. You also don’t know how your words affect people who have fallen in love with people from other countries and are trying to bring them into America to live and build a life. It makes it harder for those people to want to come to this country because of the hate that you constantly spread about them. It truly isn’t fair, because they have not done anything to you or this country. Honestly, figure your shit out before you call these countries shithole countries, because at this point their countries are far better than America.Mr. President please I am begging you stop making my job more difficult by the hate you spread about other countries. We Peace Corps Volunteers are trying our best to build communities and create families we can’t do that when people think our president hates them because sometimes they associate us with that hatred and they think that we also hate them, which is not true we love our host countries and think the world of the people that we have met.Last thing Mr. President, do us all a favor and go visit these countries. See for yourself that they are indeed not shithole countries, that they are FAR FAR FAR better than you think. If you spend just one day in these countries you would see what you were missing and your life and your heart would change and I think you might even develop kindness toward others.Now Mr. President, spread love not hate.Keep Reading",2018/01/21,snopes,0
https://www.snopes.com/fact-check/image-shows-george-orwell-and-ernest-hemingway-during-the-spanish-civil-war/,a photograph from the spanish civil war shows famed authors george orwell and ernest hemingway in close proximity.,Miscaptioned,"['ernest hemingway', ' george orwell', ' hemmingway', ' puppy', ' spanish civil war']",http://georgeorwell.org/,http://georgeorwell.org/SpanishCivilWar.htm,2017/11/20,"Orwell, the tall figure in the middle fighting in Spain with the Marxist POUM Partido Obrero de Unification Marxista. Orwell's wife Eileen is seated to his left .Orwell was shot in the throat His wife helped him escape to France after the members of the POUM were arrested by the republicans . The Battle for Spain: The Spanish Civil War 1936-1939In December 1936, Orwell went to Spain as a fighter for the Republican side in the Spanish Civil War that was provoked by Francisco Franco's Fascist uprising . He did not join the International Brigade as most leftist did , but the little known Marxist POUM .In conversation with Philip Mairet, editor of New English Weekly, Orwell said: 'This fascism ... somebody's got to stop it'.To Orwell, liberty and democracy went together, guaranteeing, among other things, the freedom of the artist; the present capitalist civilization was corrupt, but fascism would be morally calamitous.The POUM Barcelona 1937 Orwell in backJohn McNair (1887–1968), quotes him: 'He then said that this [writing a book] was quite secondary, and [that] his main reason for coming was to fight against Fascism'. Orwell went alone; his wife, Eileen, joined him later. He joined the Independent Labour Party contingent, which consisted of some twenty-five Britons who had joined the militia of the Workers' Party of Marxist Unification (POUM - Partido Obrero de Unificación Marxista), a revolutionary communist party. The POUM, and the radical wing of the anarcho-syndicalist CNT (Catalonia's dominant left-wing force), believed General Franco could be defeated only if the Republic's working class overthrew capitalism — a position at fundamental odds with the Spanish Communist Party, and its allies, which (backed by Soviet arms and aid) argued for a coalition with the bourgeois parties to defeat the fascist Nationalists. After July 1936 there was profound social revolution in Catalonia, Aragón, and wherever the CNT was strong, an egalitarian spirit sympathetically described in Homage to Catalonia. George Orwell - Spanish Civil War and TeaFortuitously, Orwell joined the POUM, rather than the Communist International Brigades, but his experiences — especially his and Eileen's narrow escape during a Communist purge in Barcelona in June 1937 — much increased his sympathies for the POUM, making him a life-long anti-Stalinist and firm believer in what he termed Democratic Socialism, socialism with free debate and free elections.In combat, Orwell was shot through the neck and nearly killed. At first, he feared his voice would be reduced to a permanent, painful whisper; this was not to be so, though the injury affected his voice, giving it ""a strange, compelling quietness"". He wrote in Homage to Catalonia that people frequently told him he was lucky to survive, but that he personally thought ""it would be even luckier not to be hit at all"".' People then had something we haven't got now. They didn't think of the future as something to be terrified of..' Coming up for AirGeorge and Eileen Orwell then lived in Morocco for half a year so he could recover from his wound. In that time, he wrote Coming Up for Air, his last novel before World War II. It is the most English of his novels; alarums of war mingle with images of idyllic Thames-side Edwardian childhood of protagonist George Bowling. The novel is pessimistic; industrialism and capitalism have killed the best of Old England, and there were great, new external threats. In homely terms, Bowling posits the totalitarian hypotheses of Borkenau, Orwell, Silone and Koestler: ""Old Hitler's something different. So's Joe Stalin. They aren't like these chaps in the old days who crucified people and chopped their heads off and so forth, just for the fun of it ... They're something quite new .""",2010/04/20,snopes,0
