page,claim,claim_label,tags,claim_source_domain,claim_source_url,date_check,source_body,date_fake,dataset,value
https://www.snopes.com/fact-check/was-palestine-permission-compete-eurovision-2019/,palestine will compete in eurovision 2019.,False,"['eurovision', ' israel', ' palestine', ' waterford whispers news']",https://www.dublinlive.ie/,https://www.dublinlive.ie/news/dublin-news/dublin-lord-mayor-says-ireland-14652022,2018/05/14,"NewsDublin Lord Mayor says Ireland should boycott next year's Eurovision to show solidarity with people of PalestineThe 2019 competition is set to be held in Israel - a country which Michael Mac Donncha was recently banned from enteringShareIrish Eurovision hopeful Ryan O'Shaughnessy pictured performing ‘Together’ at the Eurovision Song Contest 2018 Semi-Final One rehearsal in Lisbon, Portugal (Image: Andres Poveda Photography)Get daily updates directly to your inboxSubscribeThank you for subscribingSee our privacy noticeCould not subscribe, try again laterInvalid EmailThe Lord Mayor of Dublin believes Ireland should boycott the Eurovision Song Contest in 2019.Sinn Fein councillor Micheal Mac Donncha feels entering next year's competition - which will be held in Israel - would be appropriate because of the country's ongoing conflict with Palestine.Councillor Mac Donncha was recently banned from entering the Middle Eastern country after attending a conference in Ramallah at the invitation of the Palestinian Authority.At the time, the Israeli embassy in Dublin accused Mac Donncha and Dublin City Council of “waging a campaign of hatred and discrimination” against them.Read MoreAnd speaking to Dublin Live about Israel's role in hosting next year's Eurovision, Mac Donncha said Ireland should show solidarity with the Palestinian people by refusing to enter.He said: ""I would support that, I don't think we should send a representative.Dublin Mayor Micheal Mac Donncha (Image: Collins/Gareth Chaney)Read MoreCrowds gather outside US Embassy to protest recognition of Jerusalem as Israeli capital""I think the horrific ordeal of the Palestinian people needs to be highlighted. There needs to be solidarity just as there was with the people of South Africa with the apartheid regime.""Mac Donncha added: ""The Irish-Palestine solidarity campaign has collected the names of 500 artists who have said they would not work in the state of Israel, that they would boycott it in the protest and the treatment of the Palestinian people.""Last month, Dublin City Council voted to support a boycott and economic sanctions against Israel over the country's response to recent protests at the Gaza border.It also voted to support cutting ties with IT giant Hewlett Packard (HP), with a motion claiming the company's technology is being used to support the Israeli occupation of the West Bank.Read More",2018/05/13,snopes,0
https://www.snopes.com/fact-check/water-weal-2/,drinking four glasses of water at the beginning of each day will prevent heart attacks and cure various diseases.,False,"['cancer', ' medical myths']",http://ezinearticles.com/,http://ezinearticles.com/?Drinking-Water---Does-it-Lower-Blood-Pressure?&id=1416187,2014/07/20,"Basic PLUS Author | 25 ArticlesJoined: February 19, 2008Drinking Water - Does it Lower Blood Pressure?By Judith Airey | Submitted On August 16, 2008Sometimes when reading tips for reducing blood pressure, drinking water is recommended. However, authority websites including the National Heart, Lung and Blood Institute and the Mayo Clinic do not mention drinking water, when discussing treatments and lifestyle changes for hypertension.Why should some articles say that drinking water lowers blood pressure?The idea that drinking water will lower blood pressure seems to come from the idea that when lots of water is consumed, that sodium will be flushed out of the body and consequently pressure will drop.After all, several classes of diuretics are very effective at reducing pressure. These diuretics function by increasing the loss of sodium from the body and an increased volume of urine. Both the loss of sodium from the blood and decreasing the blood volume result in decreased blood pressure.So, if drugs, that effectively lower blood pressure in most people, work by increasing the volume of urine and the amount of sodium in the urine, then drinking more water should do the same thing?Unfortunately, there is a problem with this reasoning. To understand why, it is necessary to understand that the body very tightly controls the levels of fluid and ions such as sodium and calcium. For optimal functioning, the body has evolved a wide range of control processes that are involved in keeping many ions and fluid levels within a narrow range.Diuretics act on parts of the system that control sodium. For instance thiazide diuretics bind to, and inhibit, a protein called the Na/Cl symporter (Na=sodium, Cl=chloride) that controls the amount of sodium that is reabsorbed back into the blood from the urine that is being formed. The result is that the body recovers less sodium from the urine as it is being formed, and so more sodium is lost in the urine and there is a slight increase in volume. So diuretics affect the regulatory system and change a part of this.Water has no impact on the sodium or fluid control system so it will not change the total amount of sodium in the urine, or change the blood volume. Drinking more water will increase the volume of urine as the body regulates fluid levels, to keep the blood volume stable. Additionally, the same amount of sodium (and other ions etc.) in a bigger volume will lead to the urine being more dilute.Think about the color of urine. If not much fluid has been consumed, or there has been a lot of sweating, there will a small quantity of urine with a strong yellow color (from urobilin). If a person is well hydrated, there is more urine with a pale color. Same thing with sodium. In a healthy individual, the greater the volume of urine due to increased fluid consumption, the lower the concentration of sodium.So the bottom line is that, generally, increasing the amount of water that is consumed will not increase the amount of sodium lost by the blood, so blood pressure will not be lowered.In fact, drinking water can actually cause a very short term increase in blood pressure in some people, particularly those with some types of very low blood pressure. This is only temporary and has no long term impact on blood pressure.Keeping hydrated is good for health, but overhydration has no benefit for lowering blood pressure.Judith Airey PhD. is a biomedical researcher with a range of interests including all things cardiovascular. She has several health-related websites including a blood pressure information site http://www.infobloodpressure.com/ and a blog [http://agemoreslowly.com/blog]",2013/12/04,snopes,0
https://www.snopes.com/fact-check/german-news-trump-nato/,a video shows a german newscaster laughing at president trump's statements at a nato summit.,False,['donald trump'],https://www.reuters.com/,https://www.reuters.com/article/us-nato-summit/trump-lashes-germany-demands-allies-double-nato-spending-idUSKBN1K032D,2018/07/16,"July 10, 2018 / 11:19 PM / in 4 monthsTrump calls Germany 'captive' of Russia; demands higher defense spendingJeff Mason , Robin Emmott , Alissa de Carbonnel5 Min ReadBRUSSELS (Reuters) - U.S. President Donald Trump accused Germany on Wednesday of being a “captive” of Russia due to its energy reliance, before a NATO summit where he pressed allies to more than double defense spending.Having lambasted NATO members for failing to reach a target of spending 2 percent of national income on defense, Trump told fellow leaders in Brussels he would prefer a goal of 4 percent, similar to U.S. levels, officials said.That would represent a massive upheaval of budgetary priorities in Europe where Germany and many others have pledged only to reach 2 percent by 2024 or later, and it was not clear what allies would spend the money on.At the end of the first session of a two-day summit, NATO Secretary-General Jens Stoltenberg said the aim first was to reach 2 percent, but moments later Trump tweeted that allies were undercutting the United States on trade and needed to immediately up spending.The exchange was part of an uncomfortable day as anxious Western allies were subjected to the U.S. president’s “America first” approach. His comment that Germany was controlled by Russia earned a rebuke from Berlin.“We are not prisoners, neither of Russia nor of the United States,” Germany’s Foreign Minister Heiko Maas told reporters.TWO TRUMPSBut Trump was also at times enthusiastic and affable, exchanging embraces and handshakes with fellow leaders, posing for photographs in front of a NATO military band and mingling at a summit dinner in a Brussels museum.Related CoverageNATO formally invites Macedonia to join allianceUnlike a fraught Group of Seven summit in Canada in June, Trump did not block a final leaders’ statement, which paved the way for Macedonia to start NATO membership talks and a modernization of the alliance to better deter Moscow.Earlier, Trump strode into NATO’s new glass-and-steel headquarters and into the amphitheatre-like North Atlantic Council decision-making chamber to shake hands with leaders - but only after publicly railing against Germany, one of NATO’s top European powers, at a breakfast meeting with Stoltenberg.Trump told Stoltenberg Germany was wrong to support an $11-billion Baltic Sea pipeline to import even more Russian gas while being slow to meet targets for NATO spending.“We’re supposed to be guarding against Russia, and Germany goes out and pays billions and billions of dollars a year to Russia,” Trump said in the presence of reporters.“We’re protecting Germany, we’re protecting France, we’re protecting all of these countries. And then numerous of the countries go out and make a pipeline deal with Russia where they’re paying billions of dollars into the coffers of Russia,” he said. “I think that’s very inappropriate.”Trump appeared to substantially overstate German reliance on Russian energy and to imply Berlin was funding a pipeline that Chancellor Angela Merkel says is a commercial venture.She hit back by contrasting her own experience of growing up in Soviet-controlled East Germany with the sovereign, united Germany now playing a major role in NATO.Trump and Merkel later held businesslike talks on the sidelines. Trump said he had a “very, very good relationship” with Merkel who described the two as “good partners”.U.S. President Donald Trump attends a meeting of the North Atlantic Council during a NATO summit in Brussels, Belgium July 11, 2018. REUTERS/Francois LenoirA source close to French President Emmanuel Macron said Trump had voiced his “personal attachment” to Europe and gave “rather positive and constructive messages” to his allies.“There is no break-up between America and Europe,” the source said after Macron and Trump held “friendly” talks.WEAKENING BOND?But with tensions in the alliance smoldering over Trump’s trade tariffs on European steel, his earlier comments fueled concerns about the U.S. role in keeping the peace that has reigned since World War Two.Belgian Prime Minister Charles Michel called for “fair play” and more respect for multilateralism.Baltic leaders, fearful of any repeat of Russia’s annexation of Crimea, called for unity, while Slovak President Andre Kiska said his country was “one of the good guys” because it was increasing defense spending.Those comments underscored the risks to Trump’s strategy by dividing allies between those who spend more on defense and those who do not, such as Belgium, Spain, Italy and Luxembourg, but who contribute with troops to NATO missions.NATO’s Stoltenberg later told reporters that Trump, who will meet Russian President Vladimir Putin on Monday, had used “very direct language” but that NATO spending was rising strongly.The NATO chief was also frank about the impact of Trump’s stance at a broader level.Slideshow (14 Images)“There are disagreements on trade. This is serious. My task is to try to minimize the negative impact on NATO,” he said.“So far it hasn’t impacted on NATO that much. I cannot guarantee that that will not be the case in the future. The transatlantic bond is not one, there are many ties, some of them have been weakened.”Additional reporting by William James, Sabine Siebold, Humeyra Pamuk, Phil Stewart, Writing by Alastair Macdonald and Robin Emmott, Editing by Mark Heinrich and Robin Pomeroy",2018/07/11,snopes,0
https://www.snopes.com/fact-check/north-korean-medals-photo/,a photograph shows a group of north korean generals wearing medals on their shirtsleeves and pants. see example( s ),False,"['medals', ' military', ' north korea']",https://en.wikipedia.org/,https://en.wikipedia.org/wiki/Orders_and_medals_of_North_Korea,2016/05/16,"The award system of the Democratic People's Republic of Korea (North Korea) was initially created less than one month after the foundation of the Republic. During the years of Japanese Occupation of North Korea, many of the future leaders fled to the Soviet Union. During World War II many if not close to all party leaders and KPA commanders served in the Soviet Army and as such adopted many of the Soviet Awards criteria for their own. During the late 1940s and until the Sino-Soviet Split in late 1958, orders and titles were made in the Soviet Money Mints in Moscow or Leningrad. Soviet made awards were modeled after Soviet orders and made of Sterling Silver. Initially the Orders were attached to clothing with a screw-plate, but after Soviet production stopped, production was moved to North Korea. The Screwback was replaced with a pin and the silver content was replaced by cheap tin. With the exception of a few examples of modern orders, Soviet and Czech KPA awards are the most sought after in current militaria markets. The ""Hero of the Republic"" was the highest award of the Democratic People's Republic Of Korea until the Order of Kim Il-Sung was established in 1972. Awarded for extreme heroic exploits during war. The recipient is also awarded with the Order of the National Flag 1st Class which was the nation's highest Order until the Order of Kim Il-Sung Along with the Gold Star and Order the Recipient is also honoured with the erection of a personal statue at their birthplace. This award is based upon the Soviet award ""Hero of the Soviet Union"". This title was the highest civilian award until the establishment of the Order of Kim Il-Sung in 1972. Awarded for exceptional merit and efficiency in professional labour. The recipient of this title was also awarded the Order of the National Flag 1st Class which was also the nation's highest order until the Order of Kim Il-Sung This award is based upon the Soviet award ""Hero of Socialist Labour"". The Order of Kim Il-sung is the highest decoration of the country. It is awarded for contributions to the revolution or upholding the dignity of the country home or abroad. It is usually awarded around April 15 (Day of the Sun, the birthday of Kim Il-sung). Kim Jong-il was its first recipient. With the issuance of Decree 2150 by the Presidium of the Supreme People's Assembly on February 3, 2012, the Order of Kim Jong-il was created for the 70th anniversary of his birth. The order measures 67mm in length and 65mm in width. It features the portrait of Kim Jong-il in the center of golden ear of rice above a shining five-point star, the flag of the DPRK below and the emblem of the Workers' Party of Korea above with an engraving of ""Order of Kim Jong-il"" on the back with pin and serial number. It is made to give commendation to officials, service personnel, working people, military units, organs, enterprises, and organizations who made distinguished services for the DPRK. The order ribbon is similar to the Order of Kim Il-sung in the color and the star at the center, but its design is different. Until the creation of the Order of Kim Il-sung in 1972, the highest order of the Democratic People's Republic of Korea. The ONF was based on the awarding criteria as the Soviet Order of the Badge of Honor. Order ribbon has 2 gold stripes indicating 2nd Class. Order ribbon has 3 small gold stripes indicating 3rd Class. For efficient and meritorious professional labour. Conferred to flag officers and navy commanders for outstanding leadership. Conferred to flag officers and navy commanders for outstanding leadership. The original screwplate or pin back awards were given to Division, Corp or Army field commanders for achievement in battle. The medal was awarded to commanders in both the KPA and the PLA. During the Reign of Kim Jong Il, the award became a necktie style and given for more political reasons then battle. Awarded to Regiment or lower formation commanders for skill in battle. Much like the 1st Class version it was awarded for actions during the Korean War to both Chinese and Korean soldiers. Current, it has since been changed to a necktie version and has lost its battlefield prestige. Awarded only to Non-Nationals. Awarded only to Non-Nationals. Including;Alejandro Cao de Benos ,Norbert Vollertsen in 1999Ellsworth Culver on 2006-01-10Liu Xiaoming on 2010-02-03. This ordered was originally dated 1968.2.8. for the 20th anniversary and also a screw-back (The only screw-back commemorative order), later variations are pin back and undated for the 40th and 50th anniversaries. This order could be awarded to an individual up to three times, especially if he/she is a veteran or retired officer or NCO of the KPA in recognition of services given to the country. This order was awarded only once per recipient and dated 1968.9.9. on the reverse. Awarded to people who helped found the DPRK in 1948 as well as those who contributed to national defense, development and progress in the past 20 years. This commemorative order was issued on the 30th and 40th anniversaries of the foundation of the DPRK. It was only awarded a maximum of twice to a single recipient. The obverse of this order is identical to the 20th Anniversary Commemorative Order but is not dated on the reverse. Awarded for more than 500,000 Koreans and more than 400,000 Chinese during the Korean War. Awarded for meritorious labour service. Awarded for participation in the Korean independence armies. 10,000 awarded by 1949. Awarded to military units taking part in the various military parades in commemoration of state holidays. Yonhap News Agency (27 December 2002). North Korea Handbook. Seoul: M.E. Sharpe. p. 132. ISBN 978-0-7656-3523-5. ""Past news"". kcna.co.jp. Archived from the original on 12 October 2014. Retrieved 17 January 2014. Weiser, Martin (8 January 2016). ""Chests Full of Brass: A DPRK Political History in Orders, Medals, Prizes, and Titles"". Sino-NK. Retrieved 16 April 2016. Michael Breen (1 February 2012). Kim Jong-Il, Revised and Updated: Kim Jong-il: North Koreas Dear Leader, Revised and Updated Edition. John Wiley & Sons. p. 43. ISBN 978-1-118-15377-2. Retrieved 4 July 2015. Kim Da Seul (22 June 2012). ""Kim Il Sung's Image on Medals Changed"". dailynk.com. Retrieved 8 October 2015. James Hoare (13 July 2012). Historical Dictionary of Democratic People's Republic of Korea. Scarecrow Press. p. 181. ISBN 978-0-8108-6151-0. Retrieved 4 July 2015. Sin Sik Chai; Jong Hun Hyon (1980). Cultural policy in the Democratic People's Republic of Korea. Unesco. p. 37. ISBN 978-92-3-101645-5. Retrieved 4 July 2015. Valérie Gelézeau; Koen De Ceuster; Alain Delissen (2 May 2013). De-Bordering Korea: Tangible and Intangible Legacies of the Sunshine Policy. Routledge. p. 160. ISBN 978-1-136-19253-1. Retrieved 4 July 2015. Boik, William A. (2008). Orders, Decorations, and Medals of the Democratic People's Republic of Korea. Springfield, VA: DBMPress.com. ISBN 978-0-615-19087-7. Cabral, David L. (1994). Orders and Decorations of the Democratic Peoples Republic of Korea. [Glassboro, N.J.]: Orders and Medals Society of America. OCLC 35914051. Sessler, Warren E.; McDaniel, Paul (2009). Military and Civil Awards of the Democratic People's Republic of Korea (DPRK). Henderson, Nevada: Sessler Incorporated. ISBN 978-0-615-28482-8. Wikimedia Commons has media related to Orders, decorations and medals of North Korea. Weiser, Martin (8 January 2016). ""Chests Full of Brass: A DPRK Political History in Orders, Medals, Prizes, and Titles"". Sino-NK.",2015/05/26,snopes,0
